productId,productName,price,productDetails,description,merchantName
4.94193E+18,Rice Cream (Protein) - Delicious Chocolate - AfterPay & zipPay Available,$26.90,"Allgood nutrition brings us this one of a kind combination of cream of rice, a blend of pea isolate and gold hemp seed protein ...","Allgood nutrition brings us this one of a kind combination of cream of rice, a blend of pea isolate and gold hemp seed protein ...",Elite Supps
,Cottage Pie,$10.95,High performance meal with 31g of protein. 100% halal certified ingredients only. Prepared and delivered fresh - not frozen ...,,efoodz.com.au
,Asian Sesame Chicken Salad with Peanuts 400g (NDIS) Standard / 400g Standard / High Calorie/Protein by A Life Plus (A+),$4.00,Dish Macros: Dish Size Energy Protein Fat Carbs 250g KJ CAL 19.7g 42g 5.2g 2050 490 400g 3270 782 32.2g 66.5g 8.8g Heating ...,,alifeplus.com.au
1.66199E+18,Radix Ultra 800 Plant-Based Peri-Peri,$15.47,Designed for highly active individuals with increased energy demands. Ultra meals provide a balanced profile of protein ...,Protein ， Amino Acids ， Herbal ， Supplements ， Dairy-free ， Gluten-free ， Whey ， Pea Protein ， Plant-based ， Energy,EquipOutdoors
4.53997E+18,Bondi Meal Prep - Banana Protein Shake,$6.50,Regular (425g),,Bondi Meal Prep
3.65153E+18,Usana French Vanilla Nutrimeal,$46.00,"""A low GI nutritious meal-replacement shake in vanilla flavour. Nutrimeal is a low GI formulated meal replacement drink and a ...",Vanilla ， Protein,BN Direct Australia
,BSN SYNTHA-6 2.3kg / Chocolate Milkshake,$120.00,BSN Syntha-6 Use the power of six different types of protein for ultimate fitness results! BSN Syntha-6 is an effective ｀time ...,BSN Syntha-6 Use the power of six different types of protein for ultimate fitness results! BSN Syntha-6 is an effective ｀time ...,King of Suppz
1.0115E+19,"Vital Proteins Morning Get Up & Glow, Orange - 9.3 oz",$45.11 + tax,"Vital Proteins Morning Get Up & Glow 265 g - Orange For brighter mornings, reach for our energy-boosting(1) collagen powder ...","Powder ， Vitamins ， Biotin ， Dairy-free ， Gluten-free ， Bone & Joint Health ， Digestive Health ， Energy ， Hair, Skin & Nails ， Adult",Beautylish
8.77069E+18,"Atkins Plus Protein & Fiber Creamy Milk Chocolate - 4 Shakes, 325ml Each",$55.57,Enjoy New Atkins Plus with Protein and Fiber! Each delicious Creamy Milk Chocolate shake is packed with 30g of high quality ...,Ready Serve ， Chocolate ， Protein ， Weight Loss ， Low Carb ， Chocolate,Kogan.com
5.94548E+18,Bondi Meal Prep Grass-Fed Beef Bolognese 325g,$12.90,,,Woolworths
3.30973E+17,Bondi Meal Prep - Free Range Chicken Thigh - Keto,$12.90,Regular (330g),Regular (330g),Bondi Meal Prep
,Formulite Meal Replacement Shake Sachet Box - Banana Flavour 7 x 55g Serves,$34.16,"Formulite shakes provide a healthy balance of high-protein, low-carb, low-sugar in one convenient, delicious and nutritious ...","Formulite shakes provide a healthy balance of high-protein, low-carb, low-sugar in one convenient, delicious and nutritious ...",Better Value Pharmacy
1.13837E+19,Radix Nutrition Keto 600 - Plant Based Peri-Peri,$13.48,"Providing a good source of protein, vitamins, and minerals whilst emphasising high-quality fats and limiting carbohydrates ...",Protein ， Amino Acids ， Herbal ， Supplements ， Dairy-free ， Gluten-free ， Keto ， Weight Control ， Adult ， Unisex,Travel Universe Aus
,7 Breakfasts,$60.95,"Our 7 Breakfasts bundle is designed to provide you with healthy prepared meals to keep in the freezer, perfect for when you ...",,Be Fit Food
,The Macro Shake by Macro Mike 560g / Choc PB Swirl,$47.45,"The Macro Shake is an all-in-one, nutritious meal replacement shake that is jam-packed with protein, vitamins and minerals to ...",,Supplement Warehouse
1.30235E+19,Rule 1 R1 Gain 5lb [Chocolate Fudge],$139.95,"You already have a decent base, but you want to add mass. Not just any mass, quality mass. Enter R1 Gain ? a lean gainer ...",Powder ， Chocolate ， Amino Acids ， Glutamine ， BCAA ， Muscle Gain ， Weight Gain ， Chocolate Fudge,Bodytech Supplements
1.63847E+19,Horleys Elite Mass 2.5kg - Vanilla,$99.55,"Protein, fat and carbs for super charged strength and size Ultimate combination of protein, healthy fats and complex carbs to ...",Vanilla ， Amino Acids ， Muscle Gain ， Weight Gain ， Vanilla,xtreme warehouse
,Bondi Meal Prep - New Zealand King Salmon - Keto,$14.90,Regular (265g),,Bondi Meal Prep
4.79629E+18,Sustagen Ready to Drink Vanilla 250ml,$2.19,"Overview SUSTAGEN Ready to Drink Vanilla Flavour is a low GI, high protein, nutrient packed way to start your day or great as ...","Overview SUSTAGEN Ready to Drink Vanilla Flavour is a low GI, high protein, nutrient packed way to start your day or great as ...",cutpricepharmacy.com.au
,Weight Loss No Added Gluten Meals Delivered | 5 Meals,$57.50,Choose 5 meals from our no added gluten menu. Try our weight loss meal plans with calorie-controlled meals (350 cal/meal ...,,Chefgood
1.24249E+19,Weight Loss Vegan Meal Pack | 10 Meals | Chefgood,$109.00,Choose 5 lunches & 5 dinners from our vegan menu. Try our weight loss meal plans with calorie-controlled meals (350 cal/meal ...,,Chefgood
1.89667E+18,Maxine's Burn Protein - 500g - Choc Fudge Brownie,$44.95,"Maxine¨s BURN is recommended for women who do regular weight training and exercise, whether serious or casual. Take 1 serve ...",Powder ， Chocolate ， Meal Replacement ， Protein ， Amino Acids ， Carnitine ， Whey ， Muscle Gain ， Weight Loss ， Low-fat,Aussie Health Products
4.94193E+18,Rice Cream (Protein) - Delicious Chocolate - AfterPay & zipPay Available,$26.90,"Allgood nutrition brings us this one of a kind combination of cream of rice, a blend of pea isolate and gold hemp seed protein ...","Allgood nutrition brings us this one of a kind combination of cream of rice, a blend of pea isolate and gold hemp seed protein ...",Elite Supps
7.01939E+18,Protein Shake by My Muscle Chef - Box of 12 / Mocha,$71.40,"Buy Protein Shake by My Muscle Chef for AUD $71.40 at Vitamin King. Australia's best price on vitamins, health and wellness ...",Powder ， Coffee ， Amino Acids ， BCAA ， Carnitine ， Low-fat ， Mocha,Vitamin King
9.55123E+17,Bondi Meal Prep - Free Range Chicken Breast - Keto,$12.90,Regular (330g),,Bondi Meal Prep
4.32387E+18,My Muscle Chef Spicy Buffalo Chicken with Mac & Cheese 320g,$10.95,"Designed with your nutrition in mind, our range of 50+ meals deliver on taste and nutrition. Choose from goal based meal plans ...",,The Cave Gym
5.07107E+18,White Wolf Vegan Protein + Superfood Blend 75 Serve X2 Combo Deal + Shaker,$269.00,White Wolf Vegan Superfood Blend Highlights; 100% Natural Vegan friendly No added dairy No added gluten High Protein ? 23.1g ...,White Wolf Vegan Superfood Blend Highlights; 100% Natural Vegan friendly No added dairy No added gluten High Protein ? 23.1g ...,All Supplements
9.49262E+18,Shredding Bundle Vanilla / Orange / 500ml by Pure Product Australia,$69.95,The SHREDDING BUNDLE includes: - 1 KG MEAL REPLACEMENT SHAKE - 300G FAT BURNER - PROFESSIONAL GLASS SHAKER 550ML,The SHREDDING BUNDLE includes: - 1 KG MEAL REPLACEMENT SHAKE - 300G FAT BURNER - PROFESSIONAL GLASS SHAKER 550ML,Pure Product Australia
1.76184E+18,"Garden of Life Organic Raw Protein, Unflavored - 20 oz canister",$50.37 + tax,Use RAW Protein to increase the protein content of meals just add to food or beverages. It mixes instantly and has a neutral ...,Powder ， Protein ， Amino Acids ， Glutamine ， BCAA ， Pea ， Muscle Gain ， Weight Loss ， Vegan ， Dairy-free,HerbsPro.com
7.60277E+18,Orgain Organic Protein & Greens Plant Based Protein Powder Creamy Chocolate Fudge 1.94 lbs (882 g),$46.54 + tax,"Doctor developed Great as a supplement to your diet and nutritional needs. Good source of vitamin A, vitamin C, vitamin K ...",Powder ， Protein ， Whey ， Pea ， Weight Loss ， Dairy-free ， Breakfast Drink ， Creamy Chocolate Fudge ， Plant-based,Muscle & Strength
,Nutra Organics Thriving Protein (Organic Pea Rice Blend) Smooth Vanilla 1kg,$94.95?$99.95,"With a sweet vanilla flavour and bursting with nutrients, the Nutra Organics Thriving Protein Smooth Vanilla protein ...","With a sweet vanilla flavour and bursting with nutrients, the Nutra Organics Thriving Protein Smooth Vanilla protein ...",GoodnessMe
4.93073E+18,Formulite Shake & Take Meal Replacement - 55g - Honeycomb,$6.75,"Formulite shakes provide a healthy balance of high-protein, low-carb, low-sugar in one convenient, delicious and nutritious ...","Formulite shakes provide a healthy balance of high-protein, low-carb, low-sugar in one convenient, delicious and nutritious ...",Better Value Pharmacy
,Thermo X Mr- Meal Replacement Weight Loss Shake 1kg Highest,$29.95,,,eBay.com.au - stcscientific1
,MRE LITE Whole Food Protein by Redcon1 2lb Snickerdoodle,$99.95,FOR BEST RESULTS HOW TO TAKE MIX (1) SCOOP WITH 4-6 OUNCES OF WATER OR YOUR FAVORITE BEVERAGE. SHAKE WELL AND CONSUME WHEN TO ...,FOR BEST RESULTS HOW TO TAKE MIX (1) SCOOP WITH 4-6 OUNCES OF WATER OR YOUR FAVORITE BEVERAGE. SHAKE WELL AND CONSUME WHEN TO ...,Almighty Gains Supplements
1.82515E+19,Shape Body Shake - Womens Best - Vanilla - 1 kg (33 Shakes),$27.99 ，?Was $34.99,Looking for a tasty protein shake to help manage your body weight or lose weight? Replace one meal a day with Shape Body Shake ...,Powder ， Vanilla ， Protein ， Amino Acids ， Carnitine ， Whey ， Weight Loss ， Vanilla,Women's Best AU
,5 x Protein breakfast with cocoa oatmeal 1 kg of powder (Cocoa) - Energy Feelings,$139.85,"Energy Feelings Protein Breakfast with Cocoa is a delicious combination of premium oatmeal and oat flakes, saccharomyces ...","Energy Feelings Protein Breakfast with Cocoa is a delicious combination of premium oatmeal and oat flakes, saccharomyces ...",Naturitas
1.16626E+19,Rule 1 R1 lbs 6 lbs / Chocolate Fudge,$79.95,"Rule R1 LBS Mass Gainer 6lb Try and experience it for yourself, Get yours now! Features High-quality mass gainer Added ...",Powder ， Chocolate ， Amino Acids ， Glutamine ， BCAA ， Muscle Gain ， Weight Gain ， Chocolate Fudge,Mr Vitamins
1.08146E+19,Proganics 7 Day Plant Challenge,$174.99,7 Day Plant Challenge Pack includes: 1 x Organic Plant Meal Replacement 750g 15 Serves 1 x Organic Greens Plus 300g 30 Serves ...,7 Day Plant Challenge Pack includes: 1 x Organic Plant Meal Replacement 750g 15 Serves 1 x Organic Greens Plus 300g 30 Serves ...,proganics
3.4451E+18,Optimum Nutrition Gold Standard 100% Whey (Double Rich Chocolate) 2lb,$74.95,Optimum Nutrition Gold Standard 100% Whey is packed with the highest quality of Whey Protein Isolate (WPI) available on the ...,Powder ， Chocolate ， Amino Acids ， Glutamine ， BCAA ， Muscle Gain ， Low-fat ， No Added Sugar ， Low Carb ， Double Rich Chocolate,xtreme warehouse
5.34569E+18,Optimum Nutrition Serious Mass-Chocolate-6 lbs,$74.95,"Serious Mass is the ultimate in weight gain formulas. With 1,250 calories per serving and 50 grams of protein for muscle ...",Powder ， Chocolate ， Protein ， Amino Acids ， Glutamine ， BCAA ， Whey ， Casein ， Egg ， Muscle Gain,Mr Supplement
2.00041E+18,Weight Loss No Added Gluten Meals Delivered | 10 Meals,$109.00,Choose 5 lunches & 5 dinners from our no added gluten menu. Try our weight loss meal plans with calorie-controlled meals (350 ...,,Chefgood
4.32387E+18,My Muscle Chef Spicy Buffalo Chicken with Mac & Cheese 320g,$10.95,"Designed with your nutrition in mind, our range of 50+ meals deliver on taste and nutrition. Choose from goal based meal plans ...",,The Cave Gym
,Bondi Meal Prep - New Zealand King Salmon - Keto,$14.90,Regular (265g),,Bondi Meal Prep
1.30235E+19,Rule 1 R1 Gain 5lb [Chocolate Fudge],$105.99,"You already have a decent base, but you want to add mass. Not just any mass, quality mass. Enter R1 Gain ? a lean gainer ...",Powder ， Chocolate ， Amino Acids ， Glutamine ， BCAA ， Muscle Gain ， Weight Gain ， Chocolate Fudge,My Supplement Store
,MRE LITE Whole Food Protein by Redcon1 2lb Snickerdoodle,$99.95,FOR BEST RESULTS HOW TO TAKE MIX (1) SCOOP WITH 4-6 OUNCES OF WATER OR YOUR FAVORITE BEVERAGE. SHAKE WELL AND CONSUME WHEN TO ...,FOR BEST RESULTS HOW TO TAKE MIX (1) SCOOP WITH 4-6 OUNCES OF WATER OR YOUR FAVORITE BEVERAGE. SHAKE WELL AND CONSUME WHEN TO ...,Almighty Gains Supplements
,5 x Protein breakfast with cocoa oatmeal 1 kg of powder (Cocoa) - Energy Feelings,$139.85,"Energy Feelings Protein Breakfast with Cocoa is a delicious combination of premium oatmeal and oat flakes, saccharomyces ...","Energy Feelings Protein Breakfast with Cocoa is a delicious combination of premium oatmeal and oat flakes, saccharomyces ...",Naturitas
1.16626E+19,Rule 1 R1 lbs 6 lbs / Chocolate Fudge,$79.95,"Rule R1 LBS Mass Gainer 6lb Try and experience it for yourself, Get yours now! Features High-quality mass gainer Added ...",Powder ， Chocolate ， Amino Acids ， Glutamine ， BCAA ， Muscle Gain ， Weight Gain ， Chocolate Fudge,Mr Vitamins
1.52004E+19,Weider Protein Drink 500 ml Cookies,$3.81,"For more than half a century, Weider has been creating sports and fitness supplements that are of the highest quality. In ...",Ready Serve ， Protein ， Muscle Gain ， Low-fat ， Cookies,Biuky.au
1.63424E+19,IsoWhey Men's Shake Chocolate 840g,$24.99,"Chocolate IsoWhey men¨s shake, has 30g of whey protein per serve. It also has fibre, fat burners and essential vitamins ...",Powder ， Chocolate ， Diet / Weight Loss System ， Protein ， Whey ， Weight Loss ， Chocolate,Cincotta Discount Chemist
1.66661E+17,BSN True Mass 1200 - Strawberry,$99.95,"BSN True Mass 1200 is called such because it delivers 1200 of nutrient-dense calories that consist of quality protein, plus ...",Powder ， Strawberry ， Protein ， Amino Acids ， Glutamine ， BCAA ， Whey ， Casein ， Egg ， Muscle Gain,Mr Supplement
8.54311E+18,Rice Cream (Protein) - Vanilla Cinnamon - AfterPay & zipPay Available,$26.90,"Allgood nutrition brings us this one of a kind combination of cream of rice, a blend of pea isolate and gold hemp seed protein ...","Allgood nutrition brings us this one of a kind combination of cream of rice, a blend of pea isolate and gold hemp seed protein ...",Elite Supps
1.46698E+19,Lemon Basa Fillets | Gym Meals Direct Large / Veg,$12.90,Our lemon infused Basa fillets are marinated and cooked to perfection.,,Gym Meals Direct
,Rule 1 Whey Protein Blend Protein Powder Birthday Cake / 2lb,$74.95,"Rule 1 Whey Protein Blend Rule 1 Whey Protein Blend Overview 2lb, 5lb or 10lb Serving Size -1Scoop (33g) Birthday Cake ...",,Pinnacle Performance & Nutrition
,1500cal IF Meal Set #3 Standard by A Life Plus (A+),$296.30,This is 7-Days 1500calories IF Meal Plan that delivers a total of 14 meals plus snacks. 7xLunches and 7xDinners plus 11xSnacks ...,,alifeplus.com.au
,Rapid Loss Meal Replacement Shake Chocolate 740g,$56.02,"Quick and easy to prepare at home or on the go, Rapid Loss Meal Replacement Shakes are nutritionally formulated to help keep ...","Quick and easy to prepare at home or on the go, Rapid Loss Meal Replacement Shakes are nutritionally formulated to help keep ...",Kogan.com
4.61821E+18,Celebrity Slim 7-Day Meal Replacement Programme - Rapid - Banana,$34.99,Reduce calories. Shift stubborn weight. When you feel like your lacking in the self-control department Celebrity Slim Rapid ...,Powder ， Coffee ， Protein ， Amino Acids ， Carnitine ， Whey ， Soya ， Muscle Gain ， Weight Loss ， Banana,Celebrity Slim
6.62818E+18,"Pure Product Australia Whey Protein Isolate and Concentrate Powder, Cookies 1 kilograms",$39.99?$49.99,Make powerful gains with 100% Whey Protein Isolate/Concentrate from Pure Product. Packed with low-temperature ultra-filtered ...,Powder ， Cookies and Cream ， Amino Acids ， Glutamine ， BCAA ， Muscle Gain ， Cookies & Cream,Catch.com.au
5.07107E+18,White Wolf Vegan Protein + Superfood Blend 75 Serve X2 Combo Deal + Shaker,$269.00,White Wolf Vegan Superfood Blend Highlights; 100% Natural Vegan friendly No added dairy No added gluten High Protein ? 23.1g ...,White Wolf Vegan Superfood Blend Highlights; 100% Natural Vegan friendly No added dairy No added gluten High Protein ? 23.1g ...,All Supplements
,The Man Shake - Buy 3 Get 1 Free,$149.85,The Man Shake is a healthy meal replacement in a shake specifically designed to help men with weight loss. A protein shake ...,Powder ， Weight Loss,The MAN Shake
,Wellness Core Ocean Dog Food - 1.8kg,$164.99,"Wellness Core Ocean Formula for dogs is a unique, grain-free recipe that supports and nurtures your dog's inner wellbeing. A ...","Wellness Core Ocean Formula for dogs is a unique, grain-free recipe that supports and nurtures your dog's inner wellbeing. A ...",Petbarn
6.62818E+18,"Pure Product Australia Whey Protein Isolate and Concentrate Powder, Cookies 1 kilograms",$39.99?$49.99,Make powerful gains with 100% Whey Protein Isolate/Concentrate from Pure Product. Packed with low-temperature ultra-filtered ...,Powder ， Cookies and Cream ， Amino Acids ， Glutamine ， BCAA ， Muscle Gain ， Cookies & Cream,Catch.com.au
,Weight Loss No Added Gluten Meals Delivered | 5 Meals,$57.50,Choose 5 meals from our no added gluten menu. Try our weight loss meal plans with calorie-controlled meals (350 cal/meal ...,,Chefgood
1.76184E+18,"Garden of Life Organic Raw Protein, Unflavored - 20 oz canister",$50.37 + tax,Use RAW Protein to increase the protein content of meals just add to food or beverages. It mixes instantly and has a neutral ...,Powder ， Protein ， Amino Acids ， Glutamine ， BCAA ， Pea ， Muscle Gain ， Weight Loss ， Vegan ， Dairy-free,HerbsPro.com
4.79629E+18,Sustagen Ready to Drink Vanilla 250ml,$2.19,"Overview SUSTAGEN Ready to Drink Vanilla Flavour is a low GI, high protein, nutrient packed way to start your day or great as ...","Overview SUSTAGEN Ready to Drink Vanilla Flavour is a low GI, high protein, nutrient packed way to start your day or great as ...",cutpricepharmacy.com.au
,Christmas Gift Card - Workout Meals - Best Meal Delivery,$50.00,Celebrate the Holidays with your Friends & Family by being mindful about your nutrition and help your buddies out by making ...,,Workout Meals
1.30235E+19,Rule 1 R1 Gain 5lb [Chocolate Fudge],$105.99,"You already have a decent base, but you want to add mass. Not just any mass, quality mass. Enter R1 Gain ? a lean gainer ...",Powder ， Chocolate ， Amino Acids ， Glutamine ， BCAA ， Muscle Gain ， Weight Gain ， Chocolate Fudge,My Supplement Store
1.66661E+17,BSN True Mass 1200 - Strawberry,$99.90,"BSN True Mass 1200 is called such because it delivers 1200 of nutrient-dense calories that consist of quality protein, plus ...",Powder ， Strawberry ， Protein ， Amino Acids ， Glutamine ， BCAA ， Whey ， Casein ， Egg ， Muscle Gain,xtreme warehouse
,5 x Protein breakfast with cocoa oatmeal 1 kg of powder (Cocoa) - Energy Feelings,$139.85,"Energy Feelings Protein Breakfast with Cocoa is a delicious combination of premium oatmeal and oat flakes, saccharomyces ...","Energy Feelings Protein Breakfast with Cocoa is a delicious combination of premium oatmeal and oat flakes, saccharomyces ...",Naturitas
1.76237E+19,"Mutant Mass (6,8 kg) Triple Chocolate",$122.65,"This is the ultimate new, re-formulated lean muscle gainer you've been waiting for! Mutant Mass is a serious calorie-dense ...",Powder ， Chocolate ， Protein ， Amino Acids ， Glutamine ， BCAA ， Whey ， Casein ， Pea ， Egg,PerfectBody.ie
1.4203E+19,"Nature's Plus SPIRU-TEIN High Protein Energy Meal, Vanilla - 2.4 lb canister",$87.90 + tax,Rich in flavor and nutrition - that's SPIRU-TEIN! One of life's true pleasures is enjoying a delicious treat you know is good ...,Powder ， Vanilla ， Fat-free ， Vanilla ， Plant-based,GoSupps.com
,Clean Mass 6lb Vanilla Cream by Maxs,$94.95,"MAX¨S Clean MASS - Premium Lean Mass Builder These days lean size is the GO. Sure you want to grow, but you don¨t want to get ...","MAX¨S Clean MASS - Premium Lean Mass Builder These days lean size is the GO. Sure you want to grow, but you don¨t want to get ...",Australian Sports Nutrition
1.52004E+19,Weider Protein Drink 500 ml Cookies,$3.81,"For more than half a century, Weider has been creating sports and fitness supplements that are of the highest quality. In ...",Ready Serve ， Protein ， Muscle Gain ， Low-fat ， Cookies,Biuky.au
,The Man Shake - Buy 3 Get 1 Free,$149.85,The Man Shake is a healthy meal replacement in a shake specifically designed to help men with weight loss. A protein shake ...,Powder ， Weight Loss,The MAN Shake
8.89474E+18,The Lady Shake Caramel 840g,$50.55,This product may not be right for you. The Lady Shake is a healthy meal in a shake specifically designed for women. Great for ...,This product may not be right for you. The Lady Shake is a healthy meal in a shake specifically designed for women. Great for ...,MyDeal
,Max's Clean Mass Chocolate Fudge Sundae 2.7kg,$94.90,Max's Clean Mass has raised the bar in the weight gain protein powder category. With the protein base and added carbohydrates ...,Max's Clean Mass has raised the bar in the weight gain protein powder category. With the protein base and added carbohydrates ...,Elite Supps
,Grass Fed Braised Lamb Stew 250g (NDIS) Standard / 250g Standard / Low Calorie/Protein by A Life Plus (A+),$3.25,Dish Macros: Dish Size Energy Protein Fat Carbs 250g KJ CAL 21.5g 34.1g 16.1g 1950 466 400g 2860 684 31.9g 49.3g 25.1g Heating ...,,alifeplus.com.au
1.46698E+19,Lemon Basa Fillets | Gym Meals Direct Large / Veg,$12.90,Our lemon infused Basa fillets are marinated and cooked to perfection.,,Gym Meals Direct
1.05628E+19,My Muscle Chef Crumbed Chicken Roast Potatoes 340g,$11.95,Since 2013 My Muscle Chef has been providing freshly prepared high protein meals to all Australians.,,Woolworths
,Arborio Rice,$5.99,This Arborio Rice is a short-grain rice well suited to make risotto or rice puddings because of its creamy texture. A filling ...,,Graina
2.4539E+18,DHC Protein Diet (Strawberry Milk Flavor) 7 bags|Diet|Meal Replacement,$73.35 + tax,You can get great deals by buying Dhc Protein Diet Meal Substitute - Strawberry & Milk Flavor 7 Packages all the time at JAPAN ...,You can get great deals by buying Dhc Protein Diet Meal Substitute - Strawberry & Milk Flavor 7 Packages all the time at JAPAN ...,Goods Of Japan
,BSN Syntha-6 Edge Ultra Premium Protein 45 Serve Salted Caramel 1.64kg,$124.95,"If you¨re a fan of regular Syntha 6 from BSN, which many people use as a meal replacement powder, you are going to love what ...","If you¨re a fan of regular Syntha 6 from BSN, which many people use as a meal replacement powder, you are going to love what ...",The Cave Gym
1.65156E+19,Bondi Meal Prep - Free Range Chicken Breast Mince - Keto,$12.90,Regular (330g),,Bondi Meal Prep
1.07212E+19,Thyme Lemon Chicken & Pumpkin Puree - Workout Meals - Best Meal Delivery,$12.50,"Thyme Lemon Chicken & Pumpkin Puree Moroccan Chicken with cauliflower rice Ingredients: Chicken Tenderloin (36%), Pumpkin (30 ...",,Workout Meals
2.99376E+18,BSN True Mass 1200 - Vanilla,$119.95,"True Mass 1200 10lb Try and experience it for yourself, Get yours now! Directions Mix 2 scoops with 16 oz. of cold water or ...",Powder ， Vanilla ， Protein ， Amino Acids ， Glutamine ， BCAA ， Whey ， Casein ， Egg ， Muscle Gain,Super Nutrition
1.3672E+18,On-The-Go Meal Replacement Powder 1.41oz 40G x 5 Pouches - Korean All-in-One Healthy Protein Shake Breakfast Simple Meal [ ] (7 Pack of Each Flavor),$63.42 + tax,Protein Korea Meal Replacement Powder(A Piece of Diet Menu)How to intake1. Add water to the back of the water line2. Shake ...,Protein Korea Meal Replacement Powder(A Piece of Diet Menu)How to intake1. Add water to the back of the water line2. Shake ...,GoSupps.com
3.74082E+17,Bondi Meal Prep - Free Range Chicken Thigh & Brown Rice,$12.90,Regular (365g),Regular (365g),Bondi Meal Prep
,Clean Mass 6lb Vanilla Cream by Maxs,$94.95,"MAX¨S Clean MASS - Premium Lean Mass Builder These days lean size is the GO. Sure you want to grow, but you don¨t want to get ...","MAX¨S Clean MASS - Premium Lean Mass Builder These days lean size is the GO. Sure you want to grow, but you don¨t want to get ...",Australian Sports Nutrition
3.72171E+18,"Pure Product Australia Whey Protein Isolate and Concentrate, Cookies 3 kilograms",$94.50,"WHEY PROTEIN ISOLATE / CONCENTRATEWhen training gets intense, serious athletes can¨t afford any delays in the muscle-building ...",Powder ， Cookies and Cream ， Amino Acids ， Glutamine ， BCAA ， Muscle Gain,Kogan.com
,Atkins Protein Shake Mix Chocolate 310g,$15.70,"You'll love the rich texture of from the very first sip! Smooth, tasty and delicious cold or hot, each serving contains just 3 ...","You'll love the rich texture of from the very first sip! Smooth, tasty and delicious cold or hot, each serving contains just 3 ...",Pharmacy Online
,INC Plant Protein Vanilla 2kg,$69.99,INC Plant Protein Vanilla 2kg,INC Plant Protein Vanilla 2kg,amama
2.99829E+18,Bioglan Peanut Plant Protein 300g Daily Post Work Out Protein Supplement,$21.29,Bioglan Peanut Plant Protein 300g Daily Post Work Out Protein Supplement Description BIOGLAN Peanut Plant Protein is a ...,Bioglan Peanut Plant Protein 300g Daily Post Work Out Protein Supplement Description BIOGLAN Peanut Plant Protein is a ...,MyAussieChemist
1.52004E+19,Weider Protein Drink 500 ml Cookies,$3.81,"For more than half a century, Weider has been creating sports and fitness supplements that are of the highest quality. In ...",Ready Serve ， Protein ， Muscle Gain ， Low-fat ， Cookies,Biuky.au
