productId,productName,price,productDetails,description,merchantName
,Slim Down 2 Pack Chocolate / Chocolate,$158.00,"2 x Advanced Meal Replacement Normally $191. Save $33 Made from a blend of whey and milk proteins, MCT oil and over 25 ...","2 x Advanced Meal Replacement Normally $191. Save $33 Made from a blend of whey and milk proteins, MCT oil and over 25 ...",Cassius
,Max's Muscle Meal Cookie / Choc Peanut Butter (12 Pack),$49.95,"Buy 12 and SAVE! MAX¨s Muscle Meal cookie is the ideal high protein, high energy snack! It combines a high quality protein ...",,Nutrition Capital
,# Twin Pack of BSc High Protein Low Carb Bars box (2x Boxes of 12 b...,$59.99,Twin Pack of Body Science High Protein LOW CARB Bars box (2x Boxes of 12) 19g protein per bar Only 3g of carbohydrates Source ...,Twin Pack of Body Science High Protein LOW CARB Bars box (2x Boxes of 12) 19g protein per bar Only 3g of carbohydrates Source ...,Supplement Wholesalers
,The Macro Shake by Macro Mike 560g / Choc PB Swirl,$47.45,"The Macro Shake is an all-in-one, nutritious meal replacement shake that is jam-packed with protein, vitamins and minerals to ...",,Supplement Warehouse
1.41545E+18,MTN Ops Ammo Whey Protein Meal Replacement Chocolate Trail Pack 20 Ct.,$91.62 + tax,You are what you eat. Whether youre looking for a grab-n-go for your commute to work or looking for something quick and ...,Powder ， Chocolate ， Protein ， Whey ， Muscle Gain ， Weight Loss ， Chocolate,GoSupps.com
6.28334E+18,"Orgain Organic Protein and Superfoods Plant Based Protein Powder, Creamy Chocolate Fudge, 2.64 lbs",$60.59 + tax,All product statements on this website have not been evaluated by the Food and Drug Administration. The products on this ...,Plant-based ， Powder ， Chocolate,The Season
,Redcon1 - MRE Dutch Apple Pie,$89.99,"Redcon 1 MRE - The Objective: Fuel your body with MRE, commonly known in the Military as Meals Ready-to-Eat. M.R.E. are ...",,Essential Supps Marrickville
,7 Meals,$94.95,"Our 7 Meal bundle is designed to provide you with healthy prepared meals to keep in the freezer, perfect for when you simply ...",,Be Fit Food
5.29625E+18,Bondi Meal Prep Beef Lasagne 350g,$12.90,,,Woolworths
1.50527E+19,My Muscle Chef Chipotle Chicken Burrito Bowl 450 gram,$10.95,Since 2013 My Muscle Chef has been providing freshly prepared high protein meals to all Australians.,,My Muscle Chef
,Proganics Organic Keto Meal Replacement Trial Pack,$17.00,Product Information You¨ve probably heard of the keto diet and the amazing rapid weight loss results people have achieved by ...,Product Information You¨ve probably heard of the keto diet and the amazing rapid weight loss results people have achieved by ...,Muscle Protein
2.89413E+18,Vital Strength 100% Premium Low Carb Protein 1kg : Chocolate Blast,$48.99,"THIS PRODUCT MAY NOT BE RIGHT FOR YOU. VITAMIN AND MINERAL SUPPLEMENTS SHOULD NOT REPLACE A BALANCED DIET.,100% Premium Whey ...",Powder ， Chocolate ， Amino Acids ， Glutamine ， BCAA ， Muscle Gain ， Low Carb ， Chocolate,eBay.com.au - chemistwarehouse_official
,"Beef, Chicken & Kangaroo Meal Box Weekly box - 7 x 250g meals",$35.00,"Our Mixed Meal Box comes in either weekly, fortnightly or monthly options.... so no more running out of furry friend food and ...","Our Mixed Meal Box comes in either weekly, fortnightly or monthly options.... so no more running out of furry friend food and ...",Az & Scottys
2.92607E+18,Rule 1 R1 Protein 5 LB / Frozen Banana,$134.90,"R1s flagship protein is made with super-pure 100% whey isolate, fast-acting whey hydrolysate, and virtually nothing else. ZERO ...",Powder ， Protein ， Amino Acids ， BCAA ， Whey ， Muscle Gain ， Fat-free ， Frozen Banana,Supplement Heaven
7.60277E+18,Orgain Organic Protein & Greens Plant Based Protein Powder Creamy Chocolate Fudge 1.94 lbs (882 g),$46.51 + tax,"Doctor developed Great as a supplement to your diet and nutritional needs. Good source of vitamin A, vitamin C, vitamin K ...",Powder ， Protein ， Whey ， Pea ， Weight Loss ， Dairy-free ， Breakfast Drink ， Creamy Chocolate Fudge ， Plant-based,Muscle & Strength
2.24361E+18,Complete Superfood Meal Triple Chocolate,$119.81 + tax,"Packed with protein, this powder includes nutrients you need for your best day. Add one to two scoops to water, plant-based ...",Powder ， Chocolate ， Protein ， Vegan ， Low Carb ， Triplechocolate,GoSupps.com
1.41549E+18,Fitness Outcomes Beef Chilli Con Carne Frozen Meal 350g,$8.00?$9.00,,,Woolworths
,Deluxe Chicken & Quinoa Brown Rice - Workout Meals - Best Meal Delivery,$12.50,"Deluxe Chicken & Quinoa Brown Rice Chicken Breast with Quinoa brown rice. Ingredients: Chicken Breast36%, Vegetable Quinoa ...",,Workout Meals
,28 Day Keto Meal Delivery | Be Fit Food,$334.95,"Our 28 Meal bundle is designed to provide you with healthy prepared meals to keep in the freezer, perfect for when you simply ...",,Be Fit Food
1.80236E+19,Red Dragon Protein Mousse 1 kg / Caramel Cookie Butter,$63.71?$74.95,Red Dragon Nutritionals have blown away the Dessert Protein game with their premium sourced Protein Mousse! With added MCT and ...,Caramel ， Low-fat ， Dry Mix,Fit Nutrition
1.4611E+19,Blessed Plant-Based Protein 30 Serves / Peanut Butter Cups,$59.95,"The all-natural pure golden pea protein isolate contains 23g of protein per scoop at only 4g of carbs, and all of the ...",Plant-based ， Powder ， Amino Acids ， Weight Loss ， Vegan ， Dairy-free ， Low Carb ， Peanut Butter Cups,EHPlabs.com.au
,Macro Shake Sample Pack - Try both flavours! (2x56g),$14.95,"Introducing Macro Mike's newest addition, THE MACRO SHAKE! This all-in-one nutritious meal replacement shake, is jam packed ...",Powder ， Plant-based,Macro Mike
,Isowhey VLCD French Vanilla Sachet 55g 18 Pack,$39.95,"Overview IsoWhey Optimum VLCD + Collagen is our game-changing new shake, here to help you combine weight loss with the total ...","Overview IsoWhey Optimum VLCD + Collagen is our game-changing new shake, here to help you combine weight loss with the total ...",Your Discount Chemist
1.66332E+18,Bondi Meal Prep - Choc Honeycomb Protein Shake,$6.50,Regular (425g),,Bondi Meal Prep
4.09378E+18,Protein Cookie by My Muscle Chef - Box of 12 / Triple Choc,$55.00,Looking for a high protein and low carbohydrate cookie that will help you squash those afternoon cravings? Look no further ...,Looking for a high protein and low carbohydrate cookie that will help you squash those afternoon cravings? Look no further ...,Nutrition Capital
1.80046E+19,X50 My Shake Meal Replacement 490g - Vanilla,$44.99,X50 My Shake is our best tasting formulated meal replacement. Being a meal replacement means you¨ll get all of the necessary ...,Powder ， Vanilla ， Protein ， Whey ， Weight Loss ， No Added Sugar ， Low Carb ， Vanilla,Pharmacy Junction
1.14744E+19,Axe & Sledge Home Made - 25 Serves - Chocolate Brownie,$88.90,"Meal replacement shakes have been around for decades. As per their name, they are designed to replace a meal. These products ...",Powder ， Chocolate ， Protein ， Whey ， Pea ， Egg ， Muscle Gain ， Weight Loss ， Chocolate Brownie,Amino Z
1.40772E+19,Optimum Nutrition Gold Standard 100% Isolate 24 Serves - Rich Vanilla,$69.95,High quality hydrolyzed and ultra-filtered whey protein isolate 25 Grams of protein per serving 5.5 Grams of naturally ...,Powder ， Vanilla ， Meal Replacement ， Protein ， Amino Acids ， Glutamine ， BCAA ， Whey ， Muscle Gain ， Fat-free,Oxygen Essentials For Life
7.87192E+18,Outdoor Gourmet Coq AU Vin,$12.44,Add variety to your outdoor meals with the brand-new range from the Outdoor Gourmet Company! The Outdoor Gourmet Coq au Vin ...,Gluten-free ， Entree ， Beef ， Chicken,Gearshop NZ
1.68237E+19,5 Day Vanilla Meal Replacement Shakes | Celebrity Slim,$29.99,Need a bit of a hand when it comes to self-control? Seriously struggling with the motivation to meal prep? Celebrity Slim Meal ...,Need a bit of a hand when it comes to self-control? Seriously struggling with the motivation to meal prep? Celebrity Slim Meal ...,Celebrity Slim
,Healthy Meal Replacement Shakes | Buy 3 Get 1 Free,$149.85,Buy 3 get 1 free weight loss shakes. Choose 4 delicious flavours of healthy meal replacement shakes to support your weight ...,,The Lady Shake
7.87192E+18,Outdoor Gourmet Coq AU Vin,$12.44,Add variety to your outdoor meals with the brand-new range from the Outdoor Gourmet Company! The Outdoor Gourmet Coq au Vin ...,Gluten-free ， Entree ， Beef ， Chicken,Gearshop NZ
6.86259E+18,Massaman Salmon | Products | Gym Meals Direct Large / Pumpkin Mash & Bean,$14.90,Thai Massaman-style salmon,,Gym Meals Direct
,High Protein Recipe Pack,$16.18,Hitting Your Protein Goals Have NEVER Been So Easy with This High Protein Recipe Pack Filled with 54 Delicuous and Healthy ...,,Etsy
1.14744E+19,Axe & Sledge Home Made - 25 Serves - Chocolate Brownie,$88.90,"Meal replacement shakes have been around for decades. As per their name, they are designed to replace a meal. These products ...",Powder ， Chocolate ， Protein ， Whey ， Pea ， Egg ， Muscle Gain ， Weight Loss ， Chocolate Brownie,Amino Z
1.68237E+19,5 Day Vanilla Meal Replacement Shakes | Celebrity Slim,$29.99,Need a bit of a hand when it comes to self-control? Seriously struggling with the motivation to meal prep? Celebrity Slim Meal ...,Need a bit of a hand when it comes to self-control? Seriously struggling with the motivation to meal prep? Celebrity Slim Meal ...,Celebrity Slim
,Lotus LSA Meal GF 450g,$8.20,Lotus LSA Meal is packed in Australia from a blend of imported and local ingredients. It comes in a 750 gm re-sealable oxygen ...,,Wholefood Superstore
1.80236E+19,Red Dragon Protein Mousse 1 kg / Caramel Cookie Butter,$63.71?$74.95,Red Dragon Nutritionals have blown away the Dessert Protein game with their premium sourced Protein Mousse! With added MCT and ...,Caramel ， Low-fat ， Dry Mix,Fit Nutrition
,Cottage Pie,$10.95,High performance meal with 31g of protein. 100% halal certified ingredients only. Prepared and delivered fresh - not frozen ...,,efoodz.com.au
,CUSTOM MEAL | Salmon 200g / 200g Brown Rice/Green Veg,$15.95,CUSTOM MEAL | Salmon: Customise your protein and side dish. Macros Calories Carbs Fat Protein 150g Salmon 100g Brown Rice 415 ...,,athletesnutrition.com.au
,Outdoor Gourmet Company 2 Person Beef Bourguignon,$18.95,Outdoor Gourmet Company 2 Person Beef Bourguignon Just add boiling water - no cooking required. The Outdoor Gourmet Company ...,,www.aussiestormshop.com.au
4.89046E+18,"Amazing Grass Plant Protein Superfood Powder, Vanilla - 12 oz canister",$80.17 + tax,"It is an all-in-one nutritional shake that thoughtfully combines 20g plant-based protein from superfoods like pea, chia ...",Powder ， Vanilla ， Protein ， Pea ， Muscle Gain ， Weight Loss ， Vegan ， Dairy-free ， No Added Sugar ， Vanilla,GoSupps.com
1.40772E+19,Optimum Nutrition Gold Standard 100% Isolate 24 Serves - Rich Vanilla,$69.95,High quality hydrolyzed and ultra-filtered whey protein isolate 25 Grams of protein per serving 5.5 Grams of naturally ...,Powder ， Vanilla ， Meal Replacement ， Protein ， Amino Acids ， Glutamine ， BCAA ， Whey ， Muscle Gain ， Fat-free,Oxygen Essentials For Life
,Value 10 Complete Meal Box,$130.00,"Grab the Value 10 pack and you¨ll get our top selling complete meals from our sister company, Dietlicious. Great tasting ...",,Gourmet Dinner Service
4.09378E+18,Protein Cookie by My Muscle Chef - Box of 12 / Triple Choc,$67.85,Looking for a high protein and low carbohydrate cookie that will help you squash those afternoon cravings? Look no further ...,Looking for a high protein and low carbohydrate cookie that will help you squash those afternoon cravings? Look no further ...,Supplement Warehouse
,Premium Formula By Dr Bob Roast Soup 3 X 10 Pack 55G Trio in Chicken Soup Wheyless,$119.00,Delight your taste buds & support your health goals with Whey Less! Whey Less has been formulated by Dr Robert (Bob) Buist as ...,Delight your taste buds & support your health goals with Whey Less! Whey Less has been formulated by Dr Robert (Bob) Buist as ...,TVSN
5.34569E+18,Optimum Nutrition Serious Mass-Chocolate-6 lbs,$79.95,"Serious Mass is the ultimate in weight gain formulas. With 1,250 calories per serving and 50 grams of protein for muscle ...",Powder ， Chocolate ， Protein ， Amino Acids ， Glutamine ， BCAA ， Whey ， Casein ， Egg ， Muscle Gain,Mr Vitamins
,"Chicken Parmigiana with Arugula, Beans and Sweet Potatoes 400g (NDIS) Organic / 400g Vegetarian / Low Calorie/Protein by A Life Plus (A+)",$7.00,Dish Macros: Dish Size Energy Protein Fat Carbs 250g KJ CAL 21.8g 37.9g 5g 1880 449 400g 3010 719 34.8g 60.6g 8g Heating ...,,alifeplus.com.au
8.09105E+18,Orgain Organic Plant Based Protein Powder Vanilla Bean 1.43kg Vegan Gluten Free,$55.00,Orgain Organic Sweet Vanilla Bean Protein Powder is a naturally smooth and delicious nourishment drink with 21 grams of ...,Powder ， Protein ， Pea ， Vegan ， Dairy-free ， No Added Sugar ， Plant-based,eBay.com.au - toky_9680
4.45129E+18,Faulding Nutricare Vanilla Meal Replacement 720g,$16.90,"Overview Faulding NutriCare is a hospital grade, formulated meal replacement powder containing essential vitamins, minerals ...",Powder ， Vanilla ， Protein ， Vanilla,David Jones Pharmacy
2.20405E+17,Healthy Chef-Made Meals Delivered | 5 Meals,$59.50,"Where quality meets convenience, our handcrafted meals showcase the best fresh and local produce. Try our Everyday Wellness ...","Where quality meets convenience, our handcrafted meals showcase the best fresh and local produce. Try our Everyday Wellness ...",Chefgood
1.27743E+19,"Owyn Protein Powder, Smooth Vanilla - 1.05 lb",$39.48 + tax,"OWYN 100% Plant Protein powder has unbeatable taste, superior nutrition, and the cleanest nutrient profile. This vegan-protein ...",Powder ， Vanilla ， Protein ， Amino Acids ， BCAA ， Pea ， Muscle Gain ， Weight Loss ， Vegan ， Dairy-free,Opentip.com
7.87192E+18,Outdoor Gourmet Coq AU Vin,$12.44,Add variety to your outdoor meals with the brand-new range from the Outdoor Gourmet Company! The Outdoor Gourmet Coq au Vin ...,Gluten-free ， Entree ， Beef ， Chicken,Gearshop NZ
,Value 10 Complete Meal Box,$130.00,"Grab the Value 10 pack and you¨ll get our top selling complete meals from our sister company, Dietlicious. Great tasting ...",,Gourmet Dinner Service
,"Beef, Chicken & Kangaroo Meal Box Weekly box - 7 x 500g meals",$48.00,"Our Mixed Meal Box comes in either weekly, fortnightly or monthly options.... so no more running out of furry friend food and ...","Our Mixed Meal Box comes in either weekly, fortnightly or monthly options.... so no more running out of furry friend food and ...",Az & Scottys
,Vegan Complete 360 Meal | Nutritionally Balanced | 100% Vegan | Quick & Affordable Meal | Protein Works | Choc Mint Brownie | 1kg,$95.91 + tax,"COMPLETE BALANCED MEAL: Perfectly balanced blend of protein, carbs, fats & fibre. Plus, 25 of the most intelligent ...","COMPLETE BALANCED MEAL: Perfectly balanced blend of protein, carbs, fats & fibre. Plus, 25 of the most intelligent ...",bigamart.com
6.28334E+18,"Orgain Organic Protein and Superfoods Plant Based Protein Powder, Creamy Chocolate Fudge, 2.64 lbs",$60.63 + tax,All product statements on this website have not been evaluated by the Food and Drug Administration. The products on this ...,Plant-based ， Powder ， Chocolate,The Season
,CUSTOM MEAL | Teriyaki Salmon 200g / 100g Brown Rice/Green Veg,$15.50,CUSTOM MEAL | Salmon: Customise your protein and side dish. Macros Calories Carbs Fat Protein 150g Teriyaki Salmon 100g Brown ...,,athletesnutrition.com.au
9.92466E+18,Red Dragon Protein Mousse 1 kg / White Choc Cake Batter,$59.95,Red Dragon Nutritionals have blown away the Dessert Protein game with their premium sourced Protein Mousse! With added MCT and ...,Chocolate ， Low-fat ， Dry Mix,Fitness Hero
,Weight Loss No Added Gluten Meals Delivered | 5 Meals,$57.50,Choose 5 meals from our no added gluten menu. Try our weight loss meal plans with calorie-controlled meals (350 cal/meal ...,,Chefgood
,Bondi Meal Prep - New Zealand King Salmon - Keto,$14.90,Regular (265g),,Bondi Meal Prep
6.96035E+18,BSN - Syntha 6 Edge - 26 Serves - Vanilla,$72.95,Syntha 6 edge by bsn low-calorie whey protein blend 6 different protein sources amazing taste & texture bsn syntha 6 edge is a ...,Powder ， Vanilla ， Protein ， Amino Acids ， Glutamine ， BCAA ， Whey ， Casein ， Egg ， Muscle Gain,Supplement Mart
1.44255E+19,Health Kick Mini Vanilla,$99.00,"1 x Advanced Meal Replacement Made from a blend of whey and milk proteins, MCT oil and over 25 nutrients, Cassius Advanced ...","1 x Advanced Meal Replacement Made from a blend of whey and milk proteins, MCT oil and over 25 nutrients, Cassius Advanced ...",Cassius
,28 Day Keto Meal Delivery | Be Fit Food,$334.95,"Our 28 Meal bundle is designed to provide you with healthy prepared meals to keep in the freezer, perfect for when you simply ...",,Be Fit Food
1.5425E+19,Chef's Choice Australian Blanched Almond Meal - 400g,$11.60,Good Source of Dietary Fibre and Protein. Made from ground premium Australian almonds and is fantastic for baking or desserts ...,,Organic Gourmet Food Australia
9.10367E+18,"Orgain Organic Plant Based Protein Powder Travel Pack, Creamy Chocolate Fudge - 21g of Protein, 6G of fiber, No Dairy, Gluten, Soy or Added Sugar, Non",$35.25 + tax,Orgain Organic Creamy Chocolate Fudge Protein Powder is a naturally smooth and delicious nourishment drink with 21 grams of ...,Powder ， Protein ， Pea ， Vegan ， Dairy-free ， No Added Sugar ， Creamy Chocolate Fudge ， Plant-based,Muscle & Strength
1.80046E+19,X50 My Shake Meal Replacement 490g - Vanilla,$44.99,X50 My Shake is our best tasting formulated meal replacement. Being a meal replacement means you¨ll get all of the necessary ...,Powder ， Vanilla ， Protein ， Whey ， Weight Loss ， No Added Sugar ， Low Carb ， Vanilla,Pharmacy Junction
,High Protein Recipe Pack,$16.18,Hitting Your Protein Goals Have NEVER Been So Easy with This High Protein Recipe Pack Filled with 54 Delicuous and Healthy ...,,Etsy
1.40772E+19,Optimum Nutrition Gold Standard 100% Isolate 24 Serves - Rich Vanilla,$69.95,High quality hydrolyzed and ultra-filtered whey protein isolate 25 Grams of protein per serving 5.5 Grams of naturally ...,Powder ， Vanilla ， Meal Replacement ， Protein ， Amino Acids ， Glutamine ， BCAA ， Whey ， Muscle Gain ， Fat-free,Oxygen Essentials For Life
8.96066E+18,The Healthy Man Meal Replacement Vanilla 800g / 20 Serves - AfterPay & zipPay Available,$56.99,Scientifically formulated Meal replacement designed especially for men Enhance weight loss ability^ Improve gut health Reduce ...,Scientifically formulated Meal replacement designed especially for men Enhance weight loss ability^ Improve gut health Reduce ...,Catch.com.au
1.52687E+19,UPROTEIN 2kg Mass Gainer Protein (4.4 lb) - 3 Flavours Available,$48.50,"A top Mass Gain protein powder made with a combination of five quality muscle building protein sources, plus quality ...",,Uprotein
,Buy Feel Good - WLS Meal Replacement Shake Box - VLCD Assorted Mix,$48.50,"Buy a Feel Good - WLS Meal Replacement Shake Box, which helps keep your daily calorie count low to help you lose fat, at BN ...","Buy a Feel Good - WLS Meal Replacement Shake Box, which helps keep your daily calorie count low to help you lose fat, at BN ...",BN Healthy
1.08146E+19,Proganics 7 Day Plant Challenge,$174.99,7 Day Plant Challenge Pack includes: 1 x Organic Plant Meal Replacement 750g 15 Serves 1 x Organic Greens Plus 300g 30 Serves ...,7 Day Plant Challenge Pack includes: 1 x Organic Plant Meal Replacement 750g 15 Serves 1 x Organic Greens Plus 300g 30 Serves ...,proganics
1.47162E+18,Usana Nutrimeal Bulk Pouches 30 Pack - Low Gi Meal-replacement Shake Wild Strawberry,$141.90,"Diets low in saturated fat and cholesterol, and rich in fruits, veg",,NutritionLife.com.au
,2 X Isagenix Isalean Shake Nutritional Meal Replacement Choc & Vanilla,$138.88,"2 x Canister IsaLean Protein Shake in Vanilla & Choc flavour About this item: Products sold by me are genuine, not expired ...",,eBay.com.au
8.54626E+18,Garden of Life Raw Organic Protein Vanilla Chai 580 Grams,$70.90,RAW Protein Vanilla Spiced Chai 22 ozSupports digestive health and function with live probiotics and protein-digesting enzymes ...,Powder ， Vanilla ， Protein ， Amino Acids ， BCAA ， Pea ， Muscle Gain ， Vegan ， Dairy-free ， No Added Sugar,megavitamins.com.au
7.60277E+18,Orgain Organic Protein & Greens Plant Based Protein Powder Creamy Chocolate Fudge 1.94 lbs (882 g),$71.10,"Doctor developed Great as a supplement to your diet and nutritional needs. Good source of vitamin A, vitamin C, vitamin K ...",Powder ， Protein ， Whey ， Pea ， Weight Loss ， Dairy-free ， Breakfast Drink ， Creamy Chocolate Fudge ， Plant-based,LuckyVitamin
9.30487E+18,Sunwarrior Illumin8 Lean Meal - Snickerdoodle - 720 G (1.59 lbs),$48.40,"Welcome to enlightened Nutrition! With the help of doctors and nutritionists, Lean Meal was formulated specifically using ...",Powder ， Protein ， Pea ， Weight Loss ， Vegan ， Dairy-free ， Snickerdoodle ， Plant-based,AllStarHealth.com
,Formulite Meal Replacement Shake Sachet Box - Banana Flavour 7 x 55g Serves,$34.16,"Formulite shakes provide a healthy balance of high-protein, low-carb, low-sugar in one convenient, delicious and nutritious ...","Formulite shakes provide a healthy balance of high-protein, low-carb, low-sugar in one convenient, delicious and nutritious ...",Better Value Pharmacy
4.68277E+18,Dymatize Super Mass Gainer - Rich Chocolate,$99.95,"Gaining muscle mass and size can be very challenging, especially when you have a fast metabolism or find it difficult to ...",Powder ， Chocolate ， Amino Acids ， Glutamine ， BCAA ， Muscle Gain ， Weight Gain ， Rich Chocolate,Supplement Heaven
,BSN SYNTHA-6 2.3kg / Chocolate Milkshake,$120.00,BSN Syntha-6 Use the power of six different types of protein for ultimate fitness results! BSN Syntha-6 is an effective ｀time ...,BSN Syntha-6 Use the power of six different types of protein for ultimate fitness results! BSN Syntha-6 is an effective ｀time ...,King of Suppz
2.20405E+17,Healthy Chef-Made Meals Delivered | 5 Meals,$59.50,"Where quality meets convenience, our handcrafted meals showcase the best fresh and local produce. Try our Everyday Wellness ...","Where quality meets convenience, our handcrafted meals showcase the best fresh and local produce. Try our Everyday Wellness ...",Chefgood
1.66199E+18,Radix Ultra 800 Plant-Based Peri-Peri,$15.47,Designed for highly active individuals with increased energy demands. Ultra meals provide a balanced profile of protein ...,Protein ， Amino Acids ， Herbal ， Supplements ， Dairy-free ， Gluten-free ， Whey ， Pea Protein ， Plant-based ， Energy,EquipOutdoors
,5 x Protein breakfast with cocoa oatmeal 1 kg of powder (Cocoa) - Energy Feelings,$139.85,"Energy Feelings Protein Breakfast with Cocoa is a delicious combination of premium oatmeal and oat flakes, saccharomyces ...","Energy Feelings Protein Breakfast with Cocoa is a delicious combination of premium oatmeal and oat flakes, saccharomyces ...",Naturitas
6.43818E+18,13 Lives Protein Isolate with Digestive Enzymes + Collagen 1kg - Vanilla,$84.95,"13Lives Isolate is here to let your body be your work of art! At only 107 calories per serving, this is one of the leanest ...","13Lives Isolate is here to let your body be your work of art! At only 107 calories per serving, this is one of the leanest ...",The Lipo Guy
1.15596E+19,Dymatize ISO-100 Fudge Brownie 1.6 lbs,$93.46,"Looking for a delicious, high quality, pure whey protein isolate? Look no further than Dymatize ISO 100! Renowned worldwide ...",Powder ， Chocolate ， Meal Replacement ， Protein ， Amino Acids ， Glutamine ， BCAA ， Whey ， Muscle Gain ， Fat-free,Matt Blatt
1.15919E+19,Horleys Sculpt Protein - 500g - Milk Chocolate,$29.95,"Horleys Sculpt Shaping Protein for women, made by women. Now more delicious and natural than ever. Expect a high protein ...",Powder ， Meal Replacement ， Protein ， Amino Acids ， Carnitine ， Whey ， Weight Loss ， Low Carb ， Milk Chocolate,Sporty's Health
1.4203E+19,"Nature's Plus SPIRU-TEIN High Protein Energy Meal, Vanilla - 2.4 lb canister",$87.84 + tax,Rich in flavor and nutrition - that's SPIRU-TEIN! One of life's true pleasures is enjoying a delicious treat you know is good ...,Powder ， Vanilla ， Fat-free ， Vanilla ， Plant-based,GoSupps.com
,Powder: Coffee,$55.00,"Wake up! A filling, convenient and nutritionally balanced meal, designed to deliver sustained energy. A coffee shot coupled ...","Wake up! A filling, convenient and nutritionally balanced meal, designed to deliver sustained energy. A coffee shot coupled ...",Aussielent
8.45396E+18,The Healthy Mummy Whey Protein Chocolate 300g,$39.99?$49.99,Our Protein Powder is a good source of high-quality whey protein with 26.2 grams per serve and is a whopping 90% whey protein ...,Our Protein Powder is a good source of high-quality whey protein with 26.2 grams per serve and is a whopping 90% whey protein ...,Catch.com.au
1.4611E+19,Blessed Plant-Based Protein 30 Serves / Peanut Butter Cups,$59.95,"The all-natural pure golden pea protein isolate contains 23g of protein per scoop at only 4g of carbs, and all of the ...",Plant-based ， Powder ， Amino Acids ， Weight Loss ， Vegan ， Dairy-free ， Low Carb ， Peanut Butter Cups,EHPlabs.com.au
