productId,productName,price,productDetails,description,merchantName
9.62235E+18,Rice Cream (Protein) - Raspberry Cheesecake - AfterPay & zipPay Available,$26.90,"Allgood nutrition brings us this one of a kind combination of cream of rice, a blend of pea isolate and gold hemp seed protein ...","Allgood nutrition brings us this one of a kind combination of cream of rice, a blend of pea isolate and gold hemp seed protein ...",Elite Supps
1.20231E+19,Fitness Outcomes Beef Rendang & Brown Rice 350g,$8.00?$9.00,"Fitness meets gourmet Let's face it, your body only deserves the best! That's why our gourmet, high-protein meals are designed ...",,Woolworths
7.80659E+18,30 Day Weight Loss Bundle | Weight Loss Shake Kit Australia by Rapid Loss,$135.00,Are you ready to take on the 30-Day Rapid Challenge? Kick off your weight loss journey with a bang! If you are motivated to ...,Diet / Weight Loss System ， Weight Loss,Rapid Loss
5.94548E+18,Bondi Meal Prep Grass-Fed Beef Bolognese 325g,$12.90,,,Woolworths
1.39971E+19,Strength Meals Co BBQ Chicken & Rice with Roasted Vegetables 350g,$8.50?$9.95,,,Woolworths
9.0593E+18,Celebrity Slim Choc Orange 12x55g,$39.00,"Each Celebrity Slim Meal Replacement Shake sachet contains a nutritionally balanced combination of protein, carbohydrates ...",Powder ， Protein ， Amino Acids ， Whey ， Soya ， Weight Loss ， Choc Orange,Health Vitality
3.69636E+18,Truvani Organic Vanilla Plant Based Protein Powder,$51.22 + tax,"Truvani Protein Powder is USDA Organic, non-GMO, and delicious plant-based protein powder that can help maintain or build lean ...",Plant-based ， Powder ， Vanilla ， Amino Acids ， Muscle Gain ， Vegan ， Dairy-free ， No Added Sugar ， Vanilla,HerbsPro.com
1.8216E+19,Onedown Health Vegan Chocolate Fudge Protein Powder - AfterPay & zipPay Available,$32.50,"Our protein is the perfect plant-based blend for any smoothie. Ingredients: Organic Pea Protein Isolate, Organic Rice Protein ...","Our protein is the perfect plant-based blend for any smoothie. Ingredients: Organic Pea Protein Isolate, Organic Rice Protein ...",Catch.com.au
3.41417E+18,Bondi Meal Prep Free Range Chicken Burrito 310g,$12.90,,,Woolworths
,Syntha 6 1.3kg by BSN Cookies & Cream,$69.95,What is Syntha-6 by BSN? Syntha-6 has a reputation as quite possibly the finest tasting protein shake on the market for the ...,What is Syntha-6 by BSN? Syntha-6 has a reputation as quite possibly the finest tasting protein shake on the market for the ...,Supplement World Burwood
,Macro Mike - Macro Shake PB Vanilla Ice Cream,$49.99,"Introducing Macro Mike's newest addition, THE MACRO SHAKE! This all-in-one nutritious meal replacement shake, is jam packed ...","Introducing Macro Mike's newest addition, THE MACRO SHAKE! This all-in-one nutritious meal replacement shake, is jam packed ...",Essential Supps Marrickville
5.35714E+18,Nutrition Bundle Coffee / Chocolate,$110.00?$120.00,WELCOME TO THE NUTRITION BUNDLE! Our regular powders are around 500 cal per meal. What you'll receive: 28 NUTRITIONALLY ...,,Aussielent
,Vegetarian Weight Loss Meals Delivered | 14 Meals,$144.00,Choose 7 lunches & 7 dinners from our vegetarian menu. Try our weight loss meal plans with calorie-controlled meals (350 cal ...,,Chefgood
,The Man Shake & Shaker - Buy 3 Get 1 Free,$159.80,Buy 3 bags of The Man Shake meal replacement shake + shaker and get a 4th bag free. Start your weight loss journey today. Shop ...,Buy 3 bags of The Man Shake meal replacement shake + shaker and get a 4th bag free. Start your weight loss journey today. Shop ...,The MAN Shake
,Nutra Organics Thriving Protein (Organic Pea Rice Blend) Smooth Vanilla 1kg,$94.95?$99.95,"With a sweet vanilla flavour and bursting with nutrients, the Nutra Organics Thriving Protein Smooth Vanilla protein ...","With a sweet vanilla flavour and bursting with nutrients, the Nutra Organics Thriving Protein Smooth Vanilla protein ...",GoodnessMe
9.62235E+18,Rice Cream (Protein) - Raspberry Cheesecake - AfterPay & zipPay Available,$26.90,"Allgood nutrition brings us this one of a kind combination of cream of rice, a blend of pea isolate and gold hemp seed protein ...","Allgood nutrition brings us this one of a kind combination of cream of rice, a blend of pea isolate and gold hemp seed protein ...",Elite Supps
1.65156E+19,Bondi Meal Prep - Free Range Chicken Breast Mince - Keto,$12.90,Regular (330g),,Bondi Meal Prep
,2 X Isagenix Isalean Shake Nutritional Meal Replacement Choc & Vanilla,$138.88,"2 x Canister IsaLean Protein Shake in Vanilla & Choc flavour About this item: Products sold by me are genuine, not expired ...",,eBay.com.au
1.69969E+19,Vegan Weight Loss Ready Meals | 7 Meals | Portion Controlled,$78.00,"At Chefgood, vegan weight loss meals mean great taste and variety. Choose 7 meals from our vegan menu. Try our weight loss ...",,Chefgood
1.76184E+18,"Garden of Life Organic Raw Protein, Unflavored - 20 oz canister",$50.34 + tax,Use RAW Protein to increase the protein content of meals just add to food or beverages. It mixes instantly and has a neutral ...,Powder ， Protein ， Amino Acids ， Glutamine ， BCAA ， Pea ， Muscle Gain ， Weight Loss ， Vegan ， Dairy-free,HerbsPro.com
1.78542E+19,Five Day Weight Loss Meal Delivery | 5 Meals,$57.50,Choose 5 lunches or dinners from our weight loss menu. Try our weight loss meal plans with calorie-controlled meals (350 cal ...,Choose 5 lunches or dinners from our weight loss menu. Try our weight loss meal plans with calorie-controlled meals (350 cal ...,Chefgood
1.76634E+19,"Pure Product Australia Whey Protein Isolate, 5- kilograms, Unflavoured 5 kilograms",$187.00,"WHEY PROTEIN ISOLATEPure Product Australia premium whey protein isolate is pure, clean, muscle-building fuel. Each scoop ...",Powder ， Amino Acids ， Glutamine ， BCAA ， Muscle Gain ， No Added Sugar,Kogan.com
4.99549E+18,Healthy No Added Gluten Meals Delivered | 5 Meals,$59.50,"Choose 5 meals from our healthy no added gluten menu. Where quality meets convenience, our handcrafted meals showcase the best ...",,Chefgood
1.25909E+19,Bondi Meal Prep - Asian Glazed Humpty Doo Barramundi - Keto,$14.90,Regular (300g),,Bondi Meal Prep
,900cal IF Meal Set #2 Standard by A Life Plus (A+),$205.85,This is 7-Days IF Meal Plan that delivers a total of 14 meals. 7xLunches and 7xDinners plus snacks. Meals included: Braised ...,,alifeplus.com.au
,Turkey Mince Poke Bowl - Workout Meals - Best Meal Delivery,$10.55,Turkey Mince Poke Bow You don¨t need to be a hipster to enjoy our Turkey Poke Bowl! This the dish is loaded with good fats to ...,,Workout Meals
1.31651E+19,Bondi Meal Prep Free Range Chicken Pesto Pasta 300g,$12.90,,,Woolworths
2.24361E+18,Complete Superfood Meal Triple Chocolate,$119.81 + tax,"Packed with protein, this powder includes nutrients you need for your best day. Add one to two scoops to water, plant-based ...",Powder ， Chocolate ， Protein ， Vegan ， Low Carb ， Triplechocolate,GoSupps.com
4.78361E+18,Bondi Meal Prep - Free Range Chicken Breast Wrap,$12.90,Regular (220g),,Bondi Meal Prep
8.85922E+18,No Added Dairy Weight Loss Meal Pack | 5 Meals | Ready Made Meals,$57.50,Choose 5 meals from our no added dairy menu. Try our weight loss meal plans with calorie-controlled meals (350 cal/meal ...,,Chefgood
1.25909E+19,Bondi Meal Prep - Asian Glazed Humpty Doo Barramundi - Keto,$14.90,Regular (300g),,Bondi Meal Prep
,Bondi Meal Prep - Mediterranean Frittata,$10.90,Regular (260g),,Bondi Meal Prep
1.78542E+19,Five Day Weight Loss Meal Delivery | 5 Meals,$57.50,Choose 5 lunches or dinners from our weight loss menu. Try our weight loss meal plans with calorie-controlled meals (350 cal ...,Choose 5 lunches or dinners from our weight loss menu. Try our weight loss meal plans with calorie-controlled meals (350 cal ...,Chefgood
,2 X Isagenix Isalean Shake Nutritional Meal Replacement Choc & Vanilla,$138.88,"2 x Canister IsaLean Protein Shake in Vanilla & Choc flavour About this item: Products sold by me are genuine, not expired ...",,eBay.com.au
2.24361E+18,Complete Superfood Meal Triple Chocolate,$119.81 + tax,"Packed with protein, this powder includes nutrients you need for your best day. Add one to two scoops to water, plant-based ...",Powder ， Chocolate ， Protein ， Vegan ， Low Carb ， Triplechocolate,GoSupps.com
1.1714E+19,Bondi Meal Prep - Grass-Fed Beef Pasta,$12.90,Regular (325g),,Bondi Meal Prep
1.76634E+19,"Pure Product Australia Whey Protein Isolate, 5- kilograms, Unflavoured 5 kilograms",$187.00,"WHEY PROTEIN ISOLATEPure Product Australia premium whey protein isolate is pure, clean, muscle-building fuel. Each scoop ...",Powder ， Amino Acids ， Glutamine ， BCAA ， Muscle Gain ， No Added Sugar,Kogan.com
9.80971E+18,Bondi Meal Prep - Grass FED Steak Bowl,$12.90,Regular (376g),,Bondi Meal Prep
8.01787E+18,Weight Loss Vegan Meals Delivered | 5 Meals,$57.50,Choose 5 meals from our weight loss vegan menu. Try our weight loss meal plans with calorie-controlled meals (350 cal/meal ...,Choose 5 meals from our weight loss vegan menu. Try our weight loss meal plans with calorie-controlled meals (350 cal/meal ...,Chefgood
1.39999E+19,"Grass Fed Whey Protein Powder, Vanilla Bean - 1.82 lb tub",$44.63 + tax,No Added Sugar. No Antibiotics. No Hormones. What Whey Protein Should Be I created Orgain with one simple goal in mind - to ...,Powder ， Protein ， Amino Acids ， BCAA ， Whey ， No Added Sugar ， Low Carb ， Vanilla Bean,HerbsPro.com
4.99549E+18,Healthy No Added Gluten Meals Delivered | 5 Meals,$59.50,"Choose 5 meals from our healthy no added gluten menu. Where quality meets convenience, our handcrafted meals showcase the best ...",,Chefgood
1.56059E+19,Bondi Meal Prep - Free Range Chicken Pesto Pasta,$12.90,Regular (300g),,Bondi Meal Prep
,Nasty Gal Womens Contrast Lace Trim Satin Maxi Slip Dress - Pink,$127.35,"Womens Contrast Lace Trim Satin Maxi Slip Dress - Pink - 14 - Loving lace. Feel femme and flirty in our maxi slip dress, in a ...","Womens Contrast Lace Trim Satin Maxi Slip Dress - Pink - 14 - Loving lace. Feel femme and flirty in our maxi slip dress, in a ...",Nasty Gal - AU
,"Teriyaki Free Range Chicken with Rice, Roast Pumpkin, Caramelized Onion and Spinach (NDIS) Standard / 250g by A Life Plus (A+)",$3.25,Dish Macros: Dish Size Energy Protein Fat Carbs 250g KJ CAL 36.5g 7.7g 23.1g 1320 315 400g 2130 509 56.9g 13.9g 36.2g Heating ...,,alifeplus.com.au
1.07212E+19,Thyme Lemon Chicken & Pumpkin Puree - Workout Meals - Best Meal Delivery,$12.50,"Thyme Lemon Chicken & Pumpkin Puree Moroccan Chicken with cauliflower rice Ingredients: Chicken Tenderloin (36%), Pumpkin (30 ...",,Workout Meals
1.7521E+19,Rapid Loss Vanilla Flavour Meal Replacement Shake 740g,$22.50?$45.00,Enjoy the gently spiced but sweet taste of creamy Vanilla Rapid Loss now with 30% less sugar. The ultimate weight-management ...,Enjoy the gently spiced but sweet taste of creamy Vanilla Rapid Loss now with 30% less sugar. The ultimate weight-management ...,Woolworths
7.67895E+18,Vegetarian Weight Loss Ready Meals | 7 Meals | Portion Controlled,$78.00,"At Chefgood, vegetarian weight loss meals mean great taste and variety. Choose 7 meals from our vegetarian menu. Try our ...","At Chefgood, vegetarian weight loss meals mean great taste and variety. Choose 7 meals from our vegetarian menu. Try our ...",Chefgood
1.44302E+19,"Pure Product Australia Vegan Pea and Rice Protein Isolate Powder, Chocolate 2 kilograms",$72.00,VEGAN PROTEIN ISOLATEVegan Protein Isolate is a blend of organic Brown Rice Protein and French Golden Pea Protein sourced from ...,Plant-based ， Powder ， Chocolate ， Amino Acids ， Vegan,Kogan.com
1.01111E+19,Beef Hokkien Noodles - Workout Meals - Best Meal Delivery,$12.99,"Beef Hokkien Noodles Beef Hokkien Noodles with sesame. Ingredients: Beef (40%), Hokkien Noodle (24%) (Wheat Flour, Water ...",,Workout Meals
7.80659E+18,30 Day Weight Loss Bundle | Weight Loss Shake Kit Australia by Rapid Loss,$135.00,Are you ready to take on the 30-Day Rapid Challenge? Kick off your weight loss journey with a bang! If you are motivated to ...,Diet / Weight Loss System ， Weight Loss,Rapid Loss
1.7521E+19,Rapid Loss Vanilla Flavour Meal Replacement Shake 740g,$22.50?$45.00,Enjoy the gently spiced but sweet taste of creamy Vanilla Rapid Loss now with 30% less sugar. The ultimate weight-management ...,Enjoy the gently spiced but sweet taste of creamy Vanilla Rapid Loss now with 30% less sugar. The ultimate weight-management ...,Woolworths
1.11355E+19,"Ascent Native Fuel Protein Powder Blend, Whey, Vanilla Bean - 2 lb",$51.07 + tax,Ascent's Native Fuel Vanilla Bean Whey is a convenient and easy-to-mix Vanilla Bean Protein powder that was created with one ...,Powder ， Amino Acids ， BCAA ， Muscle Gain ， Low Carb ， Vanilla Bean,Opentip.com
,Isagenix Chocolate Mint 826g Canister Weight Loss Meal Replacement,$89.95,Isagenix IsaLean High Protein Shake Scientifically Formulated Meal Replacement One Mint Chocolate Flavoured Canister on Sale ...,Isagenix IsaLean High Protein Shake Scientifically Formulated Meal Replacement One Mint Chocolate Flavoured Canister on Sale ...,eBay.com.au - healthyland
1.76634E+19,"Pure Product Australia Whey Protein Isolate, 5- kilograms, Unflavoured 5 kilograms",$187.00,"WHEY PROTEIN ISOLATEPure Product Australia premium whey protein isolate is pure, clean, muscle-building fuel. Each scoop ...",Powder ， Amino Acids ， Glutamine ， BCAA ， Muscle Gain ， No Added Sugar,Kogan.com
1.30628E+19,"Isopure Infusions Protein Powder, Tropical Punch - 14.1 oz",$57.15 + tax,Nature's Best Isopure Infusions Tropical Punch is an energizing smoothie that has 20 grams of 100 percent whey protein isolate ...,Powder ， Amino Acids ， BCAA ， Fat-free ， No Added Sugar ， Low Carb ， Tropical Punch ， Plant-based,GoSupps.com
,2 X Isagenix Protein Shake Vanilla & Choc Mint Flavour Valentines Day,$155.99,Isagenix IsaLean Shake Meal Replacement Creamy vanilla and Choc mint Flavoured shake TWO CANISTERS ON SALE FREE DOMESTIC ...,Isagenix IsaLean Shake Meal Replacement Creamy vanilla and Choc mint Flavoured shake TWO CANISTERS ON SALE FREE DOMESTIC ...,eBay.com.au - hamburgertissue
,Nasty Gal Womens Contrast Lace Trim Satin Maxi Slip Dress - Pink,$127.35,"Womens Contrast Lace Trim Satin Maxi Slip Dress - Pink - 14 - Loving lace. Feel femme and flirty in our maxi slip dress, in a ...","Womens Contrast Lace Trim Satin Maxi Slip Dress - Pink - 14 - Loving lace. Feel femme and flirty in our maxi slip dress, in a ...",Nasty Gal - AU
1.71002E+19,Nature's Best Plant-Based Protein Chocolate,$63.42 + tax,"IsopurePlant-Basedproteinpowderisanidealsourceofvegan, glutenfree, non-GMO, dairyfreeproteins ...",Plant-based ， Powder ， Chocolate ， Amino Acids ， Vegan ， Dairy-free ， No Added Sugar,GoSupps.com
1.75578E+19,HLTH Code Complete Meal (Flavor: Chocolate Macadamia),$162.11 + tax,Meal Replacement Drinks by HLTH CODE. Details: Each delicious HLTH Code Complete Meal serving contains 400 satisfying calories ...,Powder ， Chocolate ， Protein ， Whey ， Weight Loss ， No Added Sugar,GoSupps.com
1.3672E+18,On-The-Go Meal Replacement Powder 1.41oz 40G x 5 Pouches - Korean All-in-One Healthy Protein Shake Breakfast Simple Meal [ ] (7 Pack of Each Flavor),$63.42 + tax,Protein Korea Meal Replacement Powder(A Piece of Diet Menu)How to intake1. Add water to the back of the water line2. Shake ...,Protein Korea Meal Replacement Powder(A Piece of Diet Menu)How to intake1. Add water to the back of the water line2. Shake ...,GoSupps.com
4.89046E+18,"Amazing Grass Plant Protein Superfood Powder, Vanilla - 12 oz canister",$80.17 + tax,"It is an all-in-one nutritional shake that thoughtfully combines 20g plant-based protein from superfoods like pea, chia ...",Powder ， Vanilla ， Protein ， Pea ， Muscle Gain ， Weight Loss ， Vegan ， Dairy-free ， No Added Sugar ， Vanilla,GoSupps.com
,4 X Tony Ferguson High Protein Shake Chocolate 840g,$176.16,There will be delays for all deliveries due to increased parcel volumes and isolation requirements experienced by our postal ...,,eBay.com.au - nourishcottage
,Fatblaster Weight Loss Shake Low Sugar Meal Replacement Drink,$26.44,FatBlaster Weight Loss Shake Low Sugar Meal Replacement Drink Raspberry - 430g Reach your goals faster with FatBlaster's meal ...,FatBlaster Weight Loss Shake Low Sugar Meal Replacement Drink Raspberry - 430g Reach your goals faster with FatBlaster's meal ...,eBay.com.au
3.90903E+18,"NutraFusion Nutritionals PlantFusion Protein, Chocolate - 2 lb canister",$84.57 + tax,Description: Multi source plant protein 100% natural uncommonly great taste! PlantFusion combines the latest advancements in ...,Powder ， Chocolate ， Amino Acids ， Glutamine ， BCAA ， Muscle Gain ， Dairy-free ， Rich Chocolate ， Plant-based,GoSupps.com
1.5081E+19,"Probar Meal Simply Real Bar, Superfood Slam, 3 Ounce (12 Count)",$95.52 + tax,"The ProBar Meal Bar features a non-baked recipe with all-natural and organic ingredients, offering you a much healthier (and ...",Vegan ， Dairy-free ， Gluten-free ， Meal Replacement,GoSupps.com
7.72028E+18,"Orgain Simple Plant Protein Powder, Organic, Vanilla Flavor - 1.25 lbs (567 g)",$56.38 + tax,"Orgain¨s Simple Protein powder is good, clean nutrition in its truest form. Crafted with only clean, simple ingredients, this ...",Powder ， Vanilla ， Protein ， Pea ， Vegan ， Dairy-free ， Vanilla ， Plant-based,GoSupps.com
1.84277E+19,"Fairlife Nutrition Plan Vanilla, 11.5 Fluid Ounce (12 Pack)",$169.15 + tax,Get the nutrition you need with Fairlife Vanilla Nutrition Shakes. This lactose-free drink is formulated with 30g of protein ...,Ready Serve ， Vanilla ， Protein ， Low-fat,GoSupps.com
4.72856E+18,"Huel Starter Kit - Includes 2 Pouches of Nutritionally Complete 100% Vegan Powdered Meal, Scoop, Shaker and Booklet (7.7Lbs of Powder - 28 Meals)",$288.98 + tax,Huel Powder v3.0 is a nutritionally complete meal in powdered form. Just mix with water in the free shaker provided and youAre ...,Powder ， Protein ， Vegan,GoSupps.com
2.95357E+18,"Perfect Perfect Isopure, Low Carb, Dutch Chocolate - 3 lb",$71.73 + tax,"High-Quality Protein Pack your body with protein without overloading on carbs, thanks to IsoPure Protein Powder. Each serving ...",Powder ， Chocolate ， Protein ， Amino Acids ， Glutamine ， BCAA ， Whey ， Muscle Gain ， Weight Loss ， Fat-free,GoSupps.com
1.33747E+19,"Ancient Nutrition Bone Broth Protein Powder, Vanilla Flavor, 40 Servings",$176.08 + tax,"For as long as humans have been cooking food over fire, bone broth - the simmering stock of bones otherwise discarded - has ...","For as long as humans have been cooking food over fire, bone broth - the simmering stock of bones otherwise discarded - has ...",GoSupps.com
1.64703E+19,Shaklee - Life Shake Plant Protein Powder - Meal Replacement Shake - 14 Servings,$70.47 + tax,"Increased energy and satiety. Feel fuller longer with 20 grams of ultra-pure, non-GMO protein with precise ratios of all 9 ...",Powder ， Chocolate ， Protein ， Amino Acids ， Muscle Gain ， Weight Loss ， No Added Sugar ， Plant-based,GoSupps.com
,Chicken Chasseur with Cheesy Mac & Cheese Bake and Broccolini Organic / 250g by A Life Plus (A+),$16.00,Dish Macros: Dish Size Energy Protein Fat Carbs 250g KJ CAL 16.6g 21.1g 17.3g 1420 339.39 400g 2110 504.30 26.6g 29.3g 27.5g ...,,alifeplus.com.au
1.84277E+19,"Fairlife Nutrition Plan Vanilla, 11.5 Fluid Ounce (12 Pack)",$169.15 + tax,Get the nutrition you need with Fairlife Vanilla Nutrition Shakes. This lactose-free drink is formulated with 30g of protein ...,Ready Serve ， Vanilla ， Protein ， Low-fat,GoSupps.com
1.00998E+19,"Premier Protein 30g Protein Shake, 12 Pack / Cookies & Cream, 11.5 fl oz",$133.91 + tax,"Packaged in a new 11.5oz bottle, each Premier Protein shake contains 30 grams of protein, complete with all of the essential ...",Powder ， Cookies and Cream ， Protein ， Amino Acids ， Whey ， Casein ， Muscle Gain ， Weight Loss ， Low-fat ， Low Carb,GoSupps.com
1.71002E+19,Nature's Best Plant-Based Protein Chocolate,$63.42 + tax,"IsopurePlant-Basedproteinpowderisanidealsourceofvegan, glutenfree, non-GMO, dairyfreeproteins ...",Plant-based ， Powder ， Chocolate ， Amino Acids ， Vegan ， Dairy-free ， No Added Sugar,GoSupps.com
,"10 Minute Active Loading Zone, Must Use Flashers Violators Will Be",$68.20 + tax,Shop Our Other Listings Shipping Return Policy Add Us to Your Favorite Sellers List Featured Categories Food & Drink Decals ...,,eBay.com.au - signmission
1.5081E+19,"Probar Meal Simply Real Bar, Superfood Slam, 3 Ounce (12 Count)",$95.52 + tax,"The ProBar Meal Bar features a non-baked recipe with all-natural and organic ingredients, offering you a much healthier (and ...",Vegan ， Dairy-free ， Gluten-free ， Meal Replacement,GoSupps.com
1.02818E+19,Ambrosia Collective Planta Plant Protein Banana Maple French Toast,$112.77 + tax,"Planta is a great way to add healthy, lean protein to your daily routine. Ambrosia Collective¨s Planta is a great tasting ...",Plant-based ， Powder ， Amino Acids ， BCAA ， Muscle Gain ， Vegan ， Banana Maple French Toast,GoSupps.com
4.72856E+18,"Huel Starter Kit - Includes 2 Pouches of Nutritionally Complete 100% Vegan Powdered Meal, Scoop, Shaker and Booklet (7.7Lbs of Powder - 28 Meals)",$288.98 + tax,Huel Powder v3.0 is a nutritionally complete meal in powdered form. Just mix with water in the free shaker provided and youAre ...,Powder ， Protein ， Vegan,GoSupps.com
,Isagenix Chocolate Mint 826g Canister Weight Loss Meal Replacement,$89.95,Isagenix IsaLean High Protein Shake Scientifically Formulated Meal Replacement One Mint Chocolate Flavoured Canister on Sale ...,Isagenix IsaLean High Protein Shake Scientifically Formulated Meal Replacement One Mint Chocolate Flavoured Canister on Sale ...,eBay.com.au - healthyland
,4 X Tony Ferguson High Protein Shake Chocolate 840g,$176.16,There will be delays for all deliveries due to increased parcel volumes and isolation requirements experienced by our postal ...,,eBay.com.au - nourishcottage
,Power Cubes Vanilla by A Life Plus (A+),$7.50,"Chocolate Power Cube Ingredients: almonds, sunflower seeds, linseeds, cacao, coconut dates, raw vegan protein powder, organic ...","Chocolate Power Cube Ingredients: almonds, sunflower seeds, linseeds, cacao, coconut dates, raw vegan protein powder, organic ...",alifeplus.com.au
1.68783E+19,"Ryse Loaded Protein Protein Drink Mix, Cinnamon Toast - 907 g",$105.72 + tax,"Loaded Protein by Ryse is a premium protein powder that will optimise your recovery, build and performance when in and out of ...",Powder ， Amino Acids ， Muscle Gain ， Low-fat ， Cinnamon Toast,GoSupps.com
2.82135E+18,Legendary Foods 20 GR Protein Bar Alternative Tasty Pastry | Low Carb Gluten Free | Keto Friendly | No Sugar Added | High Protein Snacks | On-The-Go,$63.42 + tax,"At Legendary Foods, were on a mission to revolutionize healthy eating. Were tired of compromising between flavor and nutrition ...",Sugar-free ， Low Carb ， Gluten-free ， Meal Replacement,GoSupps.com
,Handicapped Parking $250 Fine Section 4511.69 Ohio Revised Code,$68.20 + tax,Shop Our Other Listings Shipping Return Policy Add Us to Your Favorite Sellers List Featured Categories Food & Drink Decals ...,,eBay.com.au - signmission
6.95836E+18,Alpha Lion Super Human Protein Cocoa Buffs,$126.86 + tax,"Superhuman Protein | Whey Protein Isolate Thanks to AlphaLion, you too can become a superhuman thanks to this protein. No need ...",Powder ， Chocolate ， Muscle Gain ， Cocoa Buffs,GoSupps.com
5.64102E+18,"BSN Syntha-6 Protein Powder, Chocolate Cake Batter - 5 lb jar",$168.41 + tax,Supports muscle growth. Supports muscle protein synthesis. Helps kick-start the recovery process. BSN Syntha-6 is an ultra ...,Powder ， Chocolate ， Protein ， Amino Acids ， Whey ， Casein ， Egg ， Muscle Gain ， Weight Loss ， Chocolate Cake Batter,GoSupps.com
2.48647E+18,"Alani Nu Whey Protein, Confetti Cake - 2 lbs, 8 oz",$91.62 + tax,"Don¨t wait for cheat day! The Alani Nu whey protein options feature your favorite flavors, plus they¨re packed with all the ...",Powder ， Amino Acids ， BCAA ， Muscle Gain ， Weight Loss ， Confetti Cake,GoSupps.com
1.47862E+19,"Pure Protein Protein Powder, Vanilla Cream - 16 oz",$37.98 + tax,"It?s never been easier to give your body what it needs than with Pure Protein 100% Whey Protein Powder. This convenient, easy ...",Powder ， Vanilla ， Amino Acids ， BCAA ， Muscle Gain ， Low-fat ， Vanilla Cream,GoSupps.com
,2 Vanilla Isagenix Shake Protein Shake Weight Loss Meal Replacement,$158.99,New and sealed 2 x Isagenix IsaLean Nutritional Protein Shake Meal Replacement 2 vanilla Using High Quality New Zealand Grass ...,New and sealed 2 x Isagenix IsaLean Nutritional Protein Shake Meal Replacement 2 vanilla Using High Quality New Zealand Grass ...,eBay.com.au - auwanted
1.77622E+19,TB12 Plant-Based Protein Powder | Vanilla Flavor | 30 Servings,$112.77 + tax,"Versatile: Three protein flavors for men and women on the go or mixed into a non dairy protein shake Sustainable: Clean, vegan ...",Powder ， Vanilla ， Protein ， Amino Acids ， Pea ， Muscle Gain ， Vegan ， Dairy-free ， Low Carb ， Vanilla,GoSupps.com
1.58969E+19,Lyfe Fuel Meal Replacement Shake Keto Vegan Plant Based Protein Chocolate Flavor,$148.01 + tax,The perfect combination of superfood-derived essential nutrients that deliver exactly what¨s missing from your diet. The ...,Powder ， Chocolate ， Protein ， Whey ， Pea ， Weight Loss ， Dairy-free ， Low Carb ， Chocolate ， Plant-based,GoSupps.com
